{
  "profile_id": "cg-recovery-conditions",
  "profile_version": "1.3.0",
  "calculation_spec": "weighted-components-v1",
  "component_weights": {
    "impact_buffer": 15.0,
    "pressure_buffer": 15.0,
    "energy_capacity": 15.0,
    "support_capacity": 15.0,
    "clarity_capacity": 15.0,
    "action_readiness": 15.0,
    "constraint_manageability": 10.0
  },
  "thresholds": {
    "stable": 75.0,
    "focused_support": 55.0,
    "fragile": 35.0
  }
}
